{
  "agents": [
    {
      "id": "agent.alice",
      "kind": "Agent",
      "capabilities": ["observe", "writeTrace"]
    }
  ],
  "actionTypes": [
    {"id": "observe", "kind": "ActionType"},
    {"id": "writeTrace", "kind": "ActionType"}
  ],
  "states": [
    {"id": "state.unknown", "kind": "State", "affordances": ["observe"]},
    {"id": "state.known", "kind": "State", "affordances": ["writeTrace"]}
  ],
  "actions": [
    {
      "id": "action.001",
      "kind": "Action",
      "performedBy": "agent.alice",
      "actionType": "observe",
      "fromState": "state.unknown",
      "toState": "state.known",
      "timestamp": "2026-04-11T19:00:00Z",
      "cost": 1,
      "probability": 1
    }
  ],
  "traces": [
    {
      "id": "trace.001",
      "kind": "Trace",
      "pattern": "PubSub",
      "traceKind": "publish",
      "medium": "topic:alerts",
      "timestamp": "2026-04-11T19:00:01Z",
      "topicId": "alerts",
      "messageId": "msg-001",
      "refAction": "action.001"
    }
  ]
}