{
  "agents": [
    {"id": "agent.publisher", "kind": "Agent", "capabilities": ["writeTrace"]},
    {"id": "agent.subscriber", "kind": "Agent", "capabilities": ["consume", "writeTrace"]}
  ],
  "actionTypes": [
    {"id": "consume", "kind": "ActionType"},
    {"id": "writeTrace", "kind": "ActionType"}
  ],
  "states": [
    {"id": "state.pending", "kind": "State", "affordances": ["consume", "writeTrace"]},
    {"id": "state.processed", "kind": "State", "affordances": ["writeTrace"]}
  ],
  "actions": [
    {
      "id": "action.consume.001",
      "kind": "Action",
      "performedBy": "agent.subscriber",
      "actionType": "consume",
      "fromState": "state.pending",
      "toState": "state.processed",
      "timestamp": "2026-04-11T19:20:05Z"
    }
  ],
  "traces": [
    {
      "id": "trace.publish.001",
      "kind": "Trace",
      "pattern": "PubSub",
      "traceKind": "publish",
      "medium": "topic:alerts",
      "timestamp": "2026-04-11T19:20:00Z",
      "topicId": "alerts",
      "messageId": "msg-001"
    },
    {
      "id": "trace.ack.001",
      "kind": "Trace",
      "pattern": "PubSub",
      "traceKind": "ack",
      "medium": "topic:alerts",
      "timestamp": "2026-04-11T19:20:06Z",
      "topicId": "alerts",
      "messageId": "msg-001",
      "refAction": "action.consume.001"
    }
  ]
}